aiter-kernels/torch-ext/aiter_kernels/configs/gfx942-MHC_FUSED_SINKHORN-C=512.json
{
    "M_LEQ_2048": {
        "BLOCK_M": 64,
        "BLOCK_K": 128,
        "NUM_KSPLIT": 1,
        "num_warps": 4,
        "num_stages": 1,
        "waves_per_eu": 0,
        "BLOCK_C": 128
    },
    "M_LEQ_4096": {
        "BLOCK_M": 32,
        "BLOCK_K": 128,
        "NUM_KSPLIT": 1,
        "num_warps": 2,
        "num_stages": 1,
        "waves_per_eu": 1,
        "BLOCK_C": 128
    },
    "M_LEQ_8192": {
        "BLOCK_M": 64,
        "BLOCK_K": 128,
        "BLOCK_C": 128,
        "NUM_KSPLIT": 1,
        "num_warps": 4,
        "num_stages": 2,
        "waves_per_eu": 0
    },
    "M_LEQ_16384": {
        "BLOCK_M": 64,
        "BLOCK_K": 256,
        "BLOCK_C": 32,
        "NUM_KSPLIT": 4,
        "num_warps": 4,
        "num_stages": 1,
        "waves_per_eu": 0
    },
    "any": {
        "BLOCK_M": 64,
        "BLOCK_K": 256,
        "BLOCK_C": 32,
        "NUM_KSPLIT": 4,
        "num_warps": 4,
        "num_stages": 1,
        "waves_per_eu": 0
    },
    "M_LEQ_1024": {
        "BLOCK_M": 64,
        "BLOCK_K": 128,
        "NUM_KSPLIT": 1,
        "num_warps": 4,
        "num_stages": 1,
        "waves_per_eu": 0,
        "BLOCK_C": 128
    }
}
