aiter-kernels/torch-ext/aiter_kernels/configs/gfx942-MHC_FUSED_SINKHORN.json
{
    "M_LEQ_32": {
        "BLOCK_M": 32,
        "BLOCK_K": 64,
        "waves_per_eu": 2,
        "num_stages": 1,
        "num_warps": 4,
        "NUM_KSPLIT": 2,
        "BLOCK_C": 64
    },
    "M_LEQ_64": {
        "BLOCK_M": 64,
        "BLOCK_K": 64,
        "waves_per_eu": 2,
        "num_stages": 1,
        "num_warps": 4,
        "NUM_KSPLIT": 2,
        "BLOCK_C": 64
    },
    "any": {
        "BLOCK_M": 64,
        "BLOCK_K": 64,
        "waves_per_eu": 2,
        "num_stages": 1,
        "num_warps": 4,
        "NUM_KSPLIT": 2,
        "BLOCK_C": 64
    }
}
